,Review group,doiOrLink,firstAuthor,year,title,foundThrough,mentionsFAIR,isRelevant,comments,standardsSuggestion,standardsHelp,bestPracticeSuggestion,bestPracticeHelp,documentationSuggestion,documentationHelp,dataFileSuggestion,dataFileHelp,metadataFilesSuggestion,metadataHelp,licenseSuggestion,licenseHelp,repositorySuggestion,repositoryHelp,registerySuggestion,registeryHelp,FAIRhelp,journalPublicaitonSuggestion,journalPublicationHelp
31,4,https://doi.org/10.1371/journal.pone.0213013,Madduri,2019,Reproducible big data science: A case study in continuous FAIRness,PubMed,yes,yes,Describes a workflow developed by the authors for processing big data and explains how it was made FAIR. Focuses more on the overall workflow that includes data and code rather than on making software FAIR,,,"Source code allows a reader to examine application logic [31, 32], but may 
not run on a new platform. Container technologies such as Docker [11] and Singularity [33] can be used to capture a complete software stack in a form that can be executed on many platforms",,,,,,,,,,,,,,,,
32,4,https://doi.org/10.1021/acs.jcim.0c00018,Gygli,2020,Simulation Foundry: Automated and F.A.I.R. Molecular Modeling,PubMed,yes,no,"Simulation Foundry (SF), an open platform to guarantee the repeatability of molecular
dynamics simulations (MDS). It achieves that by making simulation data and metadata FAIR. It is not focused on making research software FAIR but rather the data transitioning through it.",,,,,,,,,,,,,,,,,,,
33,4,https://dx.doi.org/10.12688%2Fwellcomeopenres.16378.2,Austin,2020,Fostering global data sharing: highlighting the recommendations of the Research Data Alliance COVID-19 working group,PubMed,yes,no,"There is a section on high-level recommendation for making software FAIR along with references, but no actionable items are directly mentioned.",,,,,,,,,,,,,,,,,,,
34,5,https://doi.org/10.12688/f1000research.10750.2,Silva,2017,General guidelines for biomedical software development,Author knowledge,,,Useful for best practices,,,"Several version control systems (VCS) can manage code development, such as Git or Mercurial. Github or Bitbucket are some examples of ready-to-use SCM.

Last but not least, inline source code documentation is very important to define and explain the different parts of the source code, making it easier for the programmers when they need to add extra features or fix bugs. 

For example, it is possible to use software containers like Docker5 to distribute complex software and help deploy it, ensuring the whole community can run the software25–27.",,,"For general documentation, Markdown or Sphinx3 (also used for Python) can be used. For Java language, there is Javadoc, while other languages have their own documentation strategy that can be followed.",,,,,"There are different types of open source licenses, that come with different conditions and restrictions. We will list the most commonly used open source licenses:

• BSD License – It is the most permissive FOSS license. Users that re-use the code can do whatever they want, except in the case of redistributing source or binary, where they must always retain the copyright notice.

• Apache Public License 2.0 – This license is very permissive. It allows the licensed source code to be used in open-source and also in closed-source software.

• GNU GPL – This license is restrictive. The users of the licensed system are free to use the licensed system without any usage restrictions; analyze it and use the results of the analysis (the source code must be provided and cannot be hidden); redistribute unchanged copies of the licensed system, and also modify and redistribute modified copies of the licensed system

• GNU LGPL – It is trade-off between the restricted GNU GPL and the permissive BSD. LGPL assumes that a library licensed under LGPL can be used in a non-GPL application. All the changes applied to the LGPL library must remain under LGPL. It assumes that all copyrights reversed on source code files, and not on the whole program.","The license should be stated clearly on the project’s front page and in the root of the source code. The full license text can be included here in a file called COPYING or LICENSE, following the standard format. The copyrights should be assigned together with the license. The common nomenclature adds the year and the organization owning the copyright: Copyright (C) <year><name of organization>. The year specification may be a range, such as 2014–2016, to restrict the copyright to a period of time28. This line should be included in the headers of all source code files, together with a short license.",,,,,,,
35,5,https://datascience.nih.gov/tools-and-analytics/best-practices-for-sharing-research-software-faq,NIH,2021,Best Practices for Sharing Research Software,Author knowledge,yes,yes,,,,"researchers are encouraged to select a repository that is appropriate for the software and code generated from the research project that has long-term sustainability via social coding repositories that are open, revision-control, source-code management systems such as GitHub(link is external), GitLab(link is external), or Bitbucket(link is external).

It is encouraged to check software for vulnerabilities prior to sharing it. The SANS institute has published a list of the top 25 software errors. These lists could help guide you in review of the software source code. See http://www.sans.org/top25-software-errors/(link is external)

There are no NIH-wide standard requirements related to quality of research software. However, NIH encourages researchers to adopt best practices of research software engineering while developing software funded by NIH with the aim of enhancing the sustainability of the software. Consider checklists such as those developed by:
- The Linux Foundation’s Core Infrastructure Initiative(link is external)
- The Software Sustainability Institute
",,"Documenting the design and purpose of your code provides others with a better understanding of your code. Providing compute platform-specific details for how your code can be installed and used would allow other programmers to test and debug the code appropriately for reproducible usage.

Better Scientific Software(link is external) is one of many information sources on that provides guidance on code documentation practices.",https://bssw.io/items?topic=documentation,"Software may be shared in multiple ways:

as source code or the executable version
as code libraries published to general or specific package distribution channels
as workflows or containers
as services and APIs",,"Consider strategies that allow your software to be citable...adding a citation.cff(link is external) file to your GitHub repository

Metadata to consider include, but not limited to are:

# Title: [Name of software]

# Description: [Describe the purpose of the software]

# Persistent Identifier: [A unique persistent identified (PID) such as a digital object identifier (DOI) or accession number supports data discovery, reporting and assessment.]

# Software Language and Version/Standard: [For example, C++ ISO/IEC 14882:2020] 

# Author(s): [Names of software developers and contributors]

# Grant Number: [In this format R01GM987654]

# Publications: [Persistent identifiers and citations for publications by your team related to this software or code.]",https://docs.github.com/en/repositories/managing-your-repositorys-settings-and-features/customizing-your-repository/about-citation-files,"Follow guidance provided by your funder. If no specific guidance is provided, NIH suggests using one of the licenses approved by the Open Source Initiative(link is external) (OSI). An OSI license makes using and contributing to research software easier because these licenses are well known and understood.",https://opensource.org/licenses,"Consider strategies that allow your software to be citable such as  Zenodo’s  ability to  assign unique Digital Object Identifiers (DOIs)(link is external) (one type of persistent identifiers) for source code released in GitHub

Specialized software packages may also be distributed via package management and library utilities such as Conda(link is external) or Bioconductor(link is external). Containers and workflows may be shared through repositories such as Dockstore(link is external)",,,,,,
36,5,https://doi.org/10.3389/fgene.2014.00199,Leprevost,2014,On best practices in the development of bioinformatics software,https://doi.org/10.1093/bioinformatics/btx192,no,yes,Refer for best practices,,,"Solutions such as Git allow the simultaneous collaboration with several projects while greatly simplifying each maintainer’s tasks of tracking and resolving bugs, handling feature requests, and launching upgrades (Torvalds, 2014a). This also helps to promote the collaborative aspect of software development since anyone can join an ongoing project and provide patches.

A test library is a series of scripts designed to test a given piece of software. It is meant to aid in quickly determining whether the software’s main modules are working as expected. Ideally, all functions of the code should be thus tested, but sometimes this is not possible because of the size or complexity of the project. What is fundamental to test, though, is whether the main logic and operations are working correctly whatever the running environment happens to be. Normally a test library is shipped together with the software and the tests are executed before installation to certify that the main features are working on the machine at hand. Another important aspect of any scientific software is that sample data be provided along with it, in a manner similar to that in which supplementary files are provided together with a manuscript. Through “real-world” examples, users can verify what to expect of the various analyses",,"Software documentation can be categorized into two groups, one targeted at software developers, the other at the end users. The former is usually found in the source code, or is linked to it, and is used to explain the particularities of the code itself, which is important especially for software updating and customization. The latter typically uses nontechnical language and is aimed at aiding the user in the process of software installation and execution. Without proper code documentation the process of resolving a bug or including new developers in the team becomes a very complicated task. Users likewise need to have access to the documentation explaining its usage, which must include all directives for installation under different operating systems (when such is the case) and for the handling of parameters and input data prior to a run. It is also important to note that we need proper documentation for biologists, as they will be the ones installing and using the programs. With easy-to-follow guidelines and instructions for non-programmers, it is possible to improve software usability.",," It is our opinion that reviewing the source code from submitted papers should be possible if desired, though publishers would obviously have to search for even more specialized reviewers for the task. ",,,,"There are several advantages to making a software project open source (Perez-Riverol et al., 2014). ",,"A topic that we should address as a community is the possibility of indexing software with a solution like the well-known DOI system. An example of such an initiative is the combined work of the Mozilla Science Lab (Mozilla Foundation, 2014), GitHub (GitHub, 2014), and Figshare (Figshare, 2014). ",https://mozillascience.github.io/code-research-object/,,,,,
37,5,"https://doi.org/10.5281/zenodo.3479199
",Chue Hong,2019,Software Citation Checklist for Authors,https://doi.org/10.12688/f1000research.26932.2,no,no,Not relevant,,,,,,,,,,,,,,,,,,,
38,5,https://libguides.mit.edu/software, MIT Libraries,,Citing & publishing software: Publishing research software,Author knowledge,no,yes,,,,"Major source code repositories, such as Github, Codeplex, BitBucket, or Sourceforge publishcode, and provide many features to support ongoing development.",,,,,,"The FORCE11 software citation principles include the recommendation that software packagesinclude a CITATION file along with other README files that documents exactly how the authorsof the software would like to be cited by others andmay vary depending on the language (for instance, R supports a citation() function as well asCITATION files).",,,,"Disciplinary software repository such as The Comprehensive R Archive Network (CRAN) or NanoHub are often heavily used among specific research communities to locate software thatcan be applied in research. General subject/replication archives such as Dataverse, Zenodo, or FigShare publish individualversions of software and data in support of replication and reuse.","https://www.re3data.org/

https://docs.github.com/en/repositories/archiving-a-github-repository/referencing-and-citing-content

http://mozillascience.github.io/code-research-object/",,,,"A software journal, such as PLOS One or The Journal of Open Research Software, allowssubmissions that ""allow for submissions entirely focused on research software"", enablingdescription and credit for research software ( Force11 software citation principles ). Like datajournals, which focus on publishing papers that describe data sets, these journals supportpublishing papers that explain and describe research software packages. Publishing a softwarepaper both serves as a way to extensively document the code, and to get publication credit foryour work.",https://www.software.ac.uk/which-journals-should-i-publish-my-software
39,5,https://coderefinery.github.io/reproducible-research/,coderefinery,,Reproducible research,Author knowledge,yes,yes,,,,"All code is version controlled 

Recording dependencies, e.g., requirements.txt

A container provides operating-system-level virtualization, sharing the host system’s kernel with other containers.

Popular container implementations are Docker and Singularity.","https://coderefinery.github.io/reproducible-research/dependencies/

https://coderefinery.github.io/reproducible-research/organizing-projects/ 

https://coderefinery.github.io/reproducible-research/environments/",Add a README file to describe the project and instructions on reproducing the results,,,,,,,,"Zenodo: A general-purpose open access repository created by OpenAIRE and CERN. Integration with GitHub, allows researchers to upload files up to 50 GB.","To find a research data repository for your data, you can search on the
Registry of Research Data Repositories (re3data) (https://www.re3data.org/)
platform and filter by country, content type, discipline, etc.",,,,,
40,5,https://dx.doi.org/10.1371%2Fjournal.pcbi.1006561,,,Ten simple rules for documenting scientific software,Author knowledge,no,yes,Whole paper is a best practice guide for documentation,,,Rule 1: Write comments as you code,,"Rule 4: Include a README file with basic information A good rule of thumb is to assume that the information contained within the README will be the only documentation your users read. For this reason, your README should include how to install and configure your software, where to find its full documentation, under what license it’s released, how to test it to ensure functionality, and acknowledgments. Furthermore, you should include your quickstart guide (as introduced in Rule 3) in your README

Rule 6: Version control your documentation A previous Ten Simple Rules article has described the virtues of using Git for your code [1]. Because your documentation is such an integral part of your code, it must be version controlled as well.

Software such as Sphinx (sphinx-doc.org), perldoc, Javadoc, and Roxygen (https://github.com/klutometis/roxygen) for R can generate documentation and even read your comments and use those to generate detailed API documentation. ","As an example of a bioinformatics library that is doing a particularly good job at version controlling their documentation, look at khmer, which has a thorough changelog containing new features, fixed bugs (separated by whether they are relevant to users or developers), known issues, and a list of the contributors to the release [9] 

The best type of documentation is documentation that writes itself. Although no software package can do all your documentation for you (yet), there are tools that can do much of the heavy lifting, such as making a website, keeping it in sync with your code, and rendering it to a portable document file (PDF). Software such as Sphinx (sphinx-doc.org), perldoc, Javadoc, and Roxygen (https://github.com/klutometis/roxygen) for R can generate documentation and even read your comments and use those to generate detailed API documentation",,,"... as well as using a “CITATION” file in citation file format (CFF) format, which is a human- and machine-readable file format designed for specifying citation information for scientific software [10].",,,,,,,,,,
41,5,https://doi.org/10.1371/journal.pcbi.1005510,Wilson,2017,"
Good enough practices in scientific computing",Author knowledge,no,yes,"""This paper focuses on these first accessible skills and perspectives—the ""good enough"" practices—for scientific computing: a minimum set of tools and techniques that we believe every researcher can and should consider adopting."" ",,,"The whole paper provides best practices.

Place a brief explanatory comment at the start of every program

Provide a simple example or test data set

Use a version control system (5h) to manage changes to a project. It's hard to know what version control tool is most widely used in research today, but the one that's most talked about is undoubtedly Git. This is largely because of GitHub, a popular hosting site that combines the technical infrastructure for collaboration via Git with a modern web interface. GitHub is free for public and open source projects and for users in academia and nonprofits. GitLab is a well-regarded alternative that some prefer, because the GitLab platform itself is free and open source. Bitbucket provides free hosting for both Git and Mercurial repositories but does not have nearly as many scientific users.

Make dependencies and requirements explicit (2g). This is usually done on a per-project rather than per-program basis, i.e., by adding a file called something like requirements.txt to the root directory of the project or by adding a ""Getting Started"" section to the README file.",,"Create an overview of your project (3a). Have a short file in the project's home directory that explains the purpose of the project. This file (generally called README, README.txt, or something similar) should contain the project's title, a brief description, up-to-date contact information, and an example or 2 of how to run various cleaning or analysis tasks. ",,,,"Make the project citable (3e) by including a CITATION file in the project's home directory that describes how to cite this project as a whole and where to find (and how to cite) any data sets, code, figures, and other artifacts that have their own DOIs. ","The example below shows the CITATION file for the Ecodata Retriever (https://github.com/weecology/retriever); for an example of a more detailed CITATION file, see the one for the khmer project (https://github.com/dib-lab/khmer).","For software, we recommend a permissive open source license such as the MIT, BSD, or Apache license

We recommend permissive software licenses rather than the GNU General Public License (GPL) because it is easier to integrate permissively licensed software into other projects; see chapter 3 in [17]. 

Have a LICENSE file in the project's home directory that clearly states what license(s) apply to the project's software, data, and manuscripts.",,"Submit code to a reputable DOI-issuing repository (2j) upon submission of paper, just as you do with data. Your software is as much a product of your research as your papers and should be as easy for people to credit. DOIs for software are provided by Figshare and Zenodo. Zenodo integrates directly with GitHub.",,,,,,
42,5,https://doi.org/10.1371/journal.pbio.1001745,Wilson,2014,Best Practices for Scientific Computing,,no,no,Not really related to softare reuse. Could be mentioned for best practices,,,,,,,,,,,,,,,,,,,
43,5,"https://doi.org/10.5281/zenodo.1327329
",Jackson,2018,Software Deposit: Where to deposit software,Author knowledge,no,yes,,,,,,,,,,,,,,"Repository hosting services: services such as GitHub 3, BitBucket 4, GitLab 5, CCPForge 6, or Microsoft Visual Studio Team Services 7 that host source code repositories are not well suited for archiving software 8. They don't create unique persistent digital identifiers for your repositories, instead you need to use URLs. Your repositories could later be deleted by yourself, breaking links to these URLs, or the repository hosting service may go out of business.

Institutional digital repositories are provided by institutions for the deposit of research objects, including software, that are created by their staff, typically to showcase their research. Even if you leave the institution, your research will remain in the repository. Examples which support software deposits include the University of Edinburgh DataShare 11, UCL Discovery 12 and the University of Sheffield figshare 13 (an example of an institution-specific deployment of the figshare digital repository platform). Funder- or publisher- mandated or recommended digital repositories are those that funders or publishers recommend, or require you to use. For example, Wellcome Open Research require that software written by a paper's authors be deposited and recommend the use of Zenodo for archived software 14, so its title, digital object identifier (DOI) 15 and licence can be cited. Springer Nature's BioMed Central 16 series of journals, requires both a link to a live version of the software (e.g. on GitHub) but also to an archived version with a DOI, for which Zenodo is recommended 17. Community recommended digital repositories are those that may be recommended for, or popular within, a specific research community. General purpose or open-to-all digital repositories are those that are available for use by any researchers in any community. The two most well-known are Zenodo 18 and figshare 19.

you may also want to consider Software Heritage 20, an international initiative to provide a universal archive and reference system for all software. Software can be explicitly deposited into the Software Heritage archive 21 via the Hal-Inria digital repository 22 which is open to use by all researchers.","It is these limitations that motivated the development of tools such as the figshare-GitHub integration 9 and Zenodo-GitHub integration 10 that support the automated deposit of software within repository hosting services into digital repositories.

re3data.org, https://www.re3data.org/is a global registry of research data repositories. It supports searching for digital repositories by country, subject and content types (which includes various types of data, software applications and source code).",,,,,
44,5,"https://doi.org/10.5281/zenodo.1327327
",Jackson,2018,Software Deposit: How to deposit software,Author knowledge,no,no,"Doesn't provide anymore recommendation than the sister publication  https://doi.org/10.5281/zenodo.1327329
",,,,,,,,,,,,,,,,,,,
45,5,https://doi.org/10.15497/rda00052,RDA COVID-19 Working Group,2020,RDA COVID-19 Recommendations and Guidelines on Data Sharing,https://dx.doi.org/10.12688%2Fwellcomeopenres.16378.2,yes,yes,"""Examples: There are various initiatives that link community members with specific digital skills to projects needing additional support, including Open Source Software helpdesk for COVID-19 (Caswell et al., 2020) and COVID-19 Cognitive City (Grape, 2020). Other initiatives aim to increase skills for engaging with software and code, such as the Carpentries (Carpentries, 2020), USA’s NIH events (NIH, 2020d); and the Galaxy Community and ELIXIR’s webinar series (ELIXIR, 2020).""",,,"The key point here is to ensure that the source code itself is shared and freely available (see information about licences below), through a platform that supports access to it and allows you to effectively track development with versioning (e.g. code repositories such as GitHub (GitHub Inc., 2020), Bitbucket (Atlassian, 2020), GitLab (GitLab, 2020), etc.).",,(Re)using code/software requires knowledge of two main aspects at minimum: environment and expected input/output.,"Resource: Ten simple rules for documenting scientific software (Lee, 2018).",,,,,"Policymakers should enact policies that encourage software to be available under an open source software licence, or at least require the software to be accessible","Resource: Choose an Open Source Licence (Choose a licence, 2020).","Such repositories include Zenodo (CERN, 2020) and Figshare (FigShare, 2020). There are communities of practice that encourage deposition of software (e.g. analysis scripts) and data in one submission. In those circumstances the selected data repository (DataCite, 2020) should provide a PID for the collection.",,,,,,
,,,,,,,,,watch this,,,,,,,,,,,,,,,,,,,
